23:06:26.818408 IP 192.168.100.71 > 192.168.100.11: ICMP echo request, id 21532, seq 1902, length 64
23:06:26.818435 IP 192.168.100.11 > 192.168.100.71: ICMP echo reply, id 21532, seq 1902, length 64
23:06:26.818764 IP 192.168.100.11.49443 > c.center-dns.jsinfo.net.domain: 17339+ PTR? 11.100.168.192.in-addr.arpa. (45)
23:06:26.831518 IP c.center-dns.jsinfo.net.domain > 192.168.100.11.49443: 17339 NXDomain* 0/1/0 (80)
23:06:26.831730 IP 192.168.100.11.35299 > c.center-dns.jsinfo.net.domain: 17198+ PTR? 71.100.168.192.in-addr.arpa. (45)
23:06:26.842531 IP c.center-dns.jsinfo.net.domain > 192.168.100.11.35299: 17198 NXDomain* 0/1/0 (80)
23:06:26.842705 IP 192.168.100.11.43722 > c.center-dns.jsinfo.net.domain: 438+ PTR? 1.7.177.61.in-addr.arpa. (41)
23:06:26.852616 IP c.center-dns.jsinfo.net.domain > 192.168.100.11.43722: 438 1/2/2 PTR c.center-dns.jsinfo.net. (153)
23:06:27.819424 IP 192.168.100.71 > 192.168.100.11: ICMP echo request, id 21532, seq 1903, length 64
23:06:27.819470 IP 192.168.100.11 > 192.168.100.71: ICMP echo reply, id 21532, seq 1903, length 64
23:06:28.820619 IP 192.168.100.71 > 192.168.100.11: ICMP echo request, id 21532, seq 1904, length 64
23:06:28.820662 IP 192.168.100.11 > 192.168.100.71: ICMP echo reply, id 21532, seq 1904, length 64
23:06:29.822740 IP 192.168.100.71 > 192.168.100.11: ICMP echo request, id 21532, seq 1905, length 64
23:06:29.822785 IP 192.168.100.11 > 192.168.100.71: ICMP echo reply, id 21532, seq 1905, length 64
23:06:30.225556 IP 192.168.100.11.39170 > hg-in-f190.1e100.net.https: Flags [S], seq 821607828, win 14600, options [mss 1460,sackOK,TS val 174043536 ecr 0,nop,wscale 7], length 0
23:06:30.226541 IP 192.168.100.11.49057 > c.center-dns.jsinfo.net.domain: 45188+ PTR? 190.128.125.74.in-addr.arpa. (45)
23:06:30.238509 IP c.center-dns.jsinfo.net.domain > 192.168.100.11.49057: 45188 1/4/4 PTR hg-in-f190.1e100.net. (225)
23:06:30.476506 IP 192.168.100.11.43543 > hg-in-f136.1e100.net.https: Flags [S], seq 3081861000, win 14600, options [mss 1460,sackOK,TS val 174043787 ecr 0,nop,wscale 7], length 0
23:06:30.476680 IP 192.168.100.11.32890 > c.center-dns.jsinfo.net.domain: 45055+ PTR? 136.128.125.74.in-addr.arpa. (45)
23:06:30.488037 IP c.center-dns.jsinfo.net.domain > 192.168.100.11.32890: 45055 1/4/4 PTR hg-in-f136.1e100.net. (225)
23:06:30.823909 IP 192.168.100.71 > 192.168.100.11: ICMP echo request, id 21532, seq 1906, length 64
23:06:30.823955 IP 192.168.100.11 > 192.168.100.71: ICMP echo reply, id 21532, seq 1906, length 64
23:06:31.022593 IP 192.168.100.6.17500 > 255.255.255.255.17500: UDP, length 110
23:06:31.022818 IP 192.168.100.11.32793 > c.center-dns.jsinfo.net.domain: 36110+ PTR? 255.255.255.255.in-addr.arpa. (46)
23:06:31.025679 IP 192.168.100.6.17500 > 192.168.103.255.17500: UDP, length 110
23:06:31.034261 IP c.center-dns.jsinfo.net.domain > 192.168.100.11.32793: 36110* 0/1/0 (81)
23:06:31.034409 IP 192.168.100.11.51877 > c.center-dns.jsinfo.net.domain: 28334+ PTR? 6.100.168.192.in-addr.arpa. (44)
23:06:31.046193 IP c.center-dns.jsinfo.net.domain > 192.168.100.11.51877: 28334 NXDomain* 0/1/0 (79)
23:06:31.046362 IP 192.168.100.11.59088 > c.center-dns.jsinfo.net.domain: 57260+ PTR? 255.103.168.192.in-addr.arpa. (46)
23:06:31.057157 IP c.center-dns.jsinfo.net.domain > 192.168.100.11.59088: 57260 NXDomain* 0/1/0 (81)
23:06:31.225419 IP 192.168.100.11.39170 > hg-in-f190.1e100.net.https: Flags [S], seq 821607828, win 14600, options [mss 1460,sackOK,TS val 174044536 ecr 0,nop,wscale 7], length 0
23:06:31.476419 IP 192.168.100.11.43543 > hg-in-f136.1e100.net.https: Flags [S], seq 3081861000, win 14600, options [mss 1460,sackOK,TS val 174044787 ecr 0,nop,wscale 7], length 0
23:06:31.826072 IP 192.168.100.71 > 192.168.100.11: ICMP echo request, id 21532, seq 1907, length 64
23:06:31.826121 IP 192.168.100.11 > 192.168.100.71: ICMP echo reply, id 21532, seq 1907, length 64
23:06:32.827371 IP 192.168.100.71 > 192.168.100.11: ICMP echo request, id 21532, seq 1908, length 64
23:06:32.827417 IP 192.168.100.11 > 192.168.100.71: ICMP echo reply, id 21532, seq 1908, length 64
23:06:33.225386 IP 192.168.100.11.39170 > hg-in-f190.1e100.net.https: Flags [S], seq 821607828, win 14600, options [mss 1460,sackOK,TS val 174046536 ecr 0,nop,wscale 7], length 0
23:06:33.476419 IP 192.168.100.11.43543 > hg-in-f136.1e100.net.https: Flags [S], seq 3081861000, win 14600, options [mss 1460,sackOK,TS val 174046787 ecr 0,nop,wscale 7], length 0
23:06:33.829374 IP 192.168.100.71 > 192.168.100.11: ICMP echo request, id 21532, seq 1909, length 64
23:06:33.829421 IP 192.168.100.11 > 192.168.100.71: ICMP echo reply, id 21532, seq 1909, length 64
23:06:34.830586 IP 192.168.100.71 > 192.168.100.11: ICMP echo request, id 21532, seq 1910, length 64
23:06:34.830631 IP 192.168.100.11 > 192.168.100.71: ICMP echo reply, id 21532, seq 1910, length 64
23:06:35.832571 IP 192.168.100.71 > 192.168.100.11: ICMP echo request, id 21532, seq 1911, length 64
23:06:35.832617 IP 192.168.100.11 > 192.168.100.71: ICMP echo reply, id 21532, seq 1911, length 64
23:06:36.833705 IP 192.168.100.71 > 192.168.100.11: ICMP echo request, id 21532, seq 1912, length 64
23:06:36.833738 IP 192.168.100.11 > 192.168.100.71: ICMP echo reply, id 21532, seq 1912, length 64
23:06:37.225348 IP 192.168.100.11.39170 > hg-in-f190.1e100.net.https: Flags [S], seq 821607828, win 14600, options [mss 1460,sackOK,TS val 174050536 ecr 0,nop,wscale 7], length 0
23:06:37.476375 IP 192.168.100.11.43543 > hg-in-f136.1e100.net.https: Flags [S], seq 3081861000, win 14600, options [mss 1460,sackOK,TS val 174050787 ecr 0,nop,wscale 7], length 0
23:06:37.834954 IP 192.168.100.71 > 192.168.100.11: ICMP echo request, id 21532, seq 1913, length 64
23:06:37.835001 IP 192.168.100.11 > 192.168.100.71: ICMP echo reply, id 21532, seq 1913, length 64
23:06:38.824720 IP tf-in-f125.1e100.net.xmpp-client > 192.168.100.11.48279: Flags [P.], seq 4120163694:4120164236, ack 639398956, win 1002, options [nop,nop,TS val 444061856 ecr 174017031], length 542
23:06:38.824771 IP 192.168.100.11.48279 > tf-in-f125.1e100.net.xmpp-client: Flags [.], ack 542, win 499, options [nop,nop,TS val 174052135 ecr 444061856], length 0
23:06:38.824930 IP 192.168.100.11.48186 > c.center-dns.jsinfo.net.domain: 36929+ PTR? 125.72.194.173.in-addr.arpa. (45)
23:06:38.835335 IP 192.168.100.71 > 192.168.100.11: ICMP echo request, id 21532, seq 1914, length 64
23:06:38.835364 IP 192.168.100.11 > 192.168.100.71: ICMP echo reply, id 21532, seq 1914, length 64
23:06:38.836165 IP c.center-dns.jsinfo.net.domain > 192.168.100.11.48186: 36929 1/4/4 PTR tf-in-f125.1e100.net. (225)
23:06:39.077505 IP 192.168.100.11.41177 > kix01s01-in-f8.1e100.net.https: Flags [P.], seq 2880744756:2880745273, ack 3011612693, win 501, length 517
23:06:39.077652 IP 192.168.100.11.47779 > c.center-dns.jsinfo.net.domain: 24879+ PTR? 200.235.125.74.in-addr.arpa. (45)
23:06:39.077748 IP 192.168.100.11.41177 > kix01s01-in-f8.1e100.net.https: Flags [P.], seq 517:554, ack 1, win 501, length 37
23:06:39.078111 IP 192.168.100.11.41177 > kix01s01-in-f8.1e100.net.https: Flags [.], seq 554:3314, ack 1, win 501, length 2760
23:06:39.078137 IP 192.168.100.11.41177 > kix01s01-in-f8.1e100.net.https: Flags [P.], seq 3314:3439, ack 1, win 501, length 125
23:06:39.078315 IP 192.168.100.11.41177 > kix01s01-in-f8.1e100.net.https: Flags [P.], seq 3439:3701, ack 1, win 501, length 262
23:06:39.090167 IP c.center-dns.jsinfo.net.domain > 192.168.100.11.47779: 24879 1/4/4 PTR kix01s01-in-f8.1e100.net. (229)
23:06:39.163822 IP kix01s01-in-f8.1e100.net.https > 192.168.100.11.41177: Flags [.], ack 517, win 1002, length 0
23:06:39.163850 IP kix01s01-in-f8.1e100.net.https > 192.168.100.11.41177: Flags [.], ack 554, win 1002, length 0
23:06:39.163864 IP kix01s01-in-f8.1e100.net.https > 192.168.100.11.41177: Flags [P.], seq 1:38, ack 554, win 1002, length 37
23:06:39.163880 IP 192.168.100.11.41177 > kix01s01-in-f8.1e100.net.https: Flags [.], ack 38, win 501, length 0
23:06:39.165509 IP kix01s01-in-f8.1e100.net.https > 192.168.100.11.41177: Flags [.], ack 3701, win 1002, length 0
23:06:39.225997 IP kix01s01-in-f8.1e100.net.https > 192.168.100.11.41177: Flags [P.], seq 38:102, ack 3701, win 1002, length 64
23:06:39.226023 IP 192.168.100.11.41177 > kix01s01-in-f8.1e100.net.https: Flags [.], ack 102, win 501, length 0
23:06:39.226292 IP kix01s01-in-f8.1e100.net.https > 192.168.100.11.41177: Flags [P.], seq 102:1482, ack 3701, win 1002, length 1380
23:06:39.226313 IP 192.168.100.11.41177 > kix01s01-in-f8.1e100.net.https: Flags [.], ack 1482, win 499, length 0
23:06:39.226323 IP kix01s01-in-f8.1e100.net.https > 192.168.100.11.41177: Flags [P.], seq 1482:2862, ack 3701, win 1002, length 1380
23:06:39.226333 IP 192.168.100.11.41177 > kix01s01-in-f8.1e100.net.https: Flags [.], ack 2862, win 489, length 0
23:06:39.226536 IP kix01s01-in-f8.1e100.net.https > 192.168.100.11.41177: Flags [P.], seq 2862:4242, ack 3701, win 1002, length 1380
23:06:39.226563 IP 192.168.100.11.41177 > kix01s01-in-f8.1e100.net.https: Flags [.], ack 4242, win 479, length 0
23:06:39.226575 IP kix01s01-in-f8.1e100.net.https > 192.168.100.11.41177: Flags [P.], seq 4242:4308, ack 3701, win 1002, length 66
23:06:39.226590 IP 192.168.100.11.41177 > kix01s01-in-f8.1e100.net.https: Flags [.], ack 4308, win 501, length 0
23:06:39.226601 IP kix01s01-in-f8.1e100.net.https > 192.168.100.11.41177: Flags [P.], seq 4308:5688, ack 3701, win 1002, length 1380
23:06:39.226615 IP 192.168.100.11.41177 > kix01s01-in-f8.1e100.net.https: Flags [.], ack 5688, win 491, length 0
23:06:39.226784 IP kix01s01-in-f8.1e100.net.https > 192.168.100.11.41177: Flags [P.], seq 5688:7068, ack 3701, win 1002, length 1380
23:06:39.226801 IP 192.168.100.11.41177 > kix01s01-in-f8.1e100.net.https: Flags [.], ack 7068, win 481, length 0
23:06:39.228014 IP kix01s01-in-f8.1e100.net.https > 192.168.100.11.41177: Flags [P.], seq 7068:8206, ack 3701, win 1002, length 1138
23:06:39.228042 IP 192.168.100.11.41177 > kix01s01-in-f8.1e100.net.https: Flags [.], ack 8206, win 499, length 0
23:06:39.267684 IP 192.168.100.11.48279 > tf-in-f125.1e100.net.xmpp-client: Flags [P.], seq 1:413, ack 542, win 501, options [nop,nop,TS val 174052578 ecr 444061856], length 412
23:06:39.327845 IP tf-in-f125.1e100.net.xmpp-client > 192.168.100.11.48279: Flags [.], ack 413, win 1002, options [nop,nop,TS val 444062358 ecr 174052578], length 0
23:06:39.836943 IP 192.168.100.71 > 192.168.100.11: ICMP echo request, id 21532, seq 1915, length 64
23:06:39.836988 IP 192.168.100.11 > 192.168.100.71: ICMP echo reply, id 21532, seq 1915, length 64
23:06:40.467018 IP6 fe80::b9a3:b4a3:7a04:10b4.dhcpv6-client > ff02::1:2.dhcpv6-server: dhcp6 solicit
23:06:40.467220 IP 192.168.100.11.55518 > c.center-dns.jsinfo.net.domain: 1706+ PTR? 2.0.0.0.1.0.0.0.0.0.0.0.0.0.0.0.0.0.0.0.0.0.0.0.0.0.0.0.2.0.f.f.ip6.arpa. (90)
23:06:40.477335 IP c.center-dns.jsinfo.net.domain > 192.168.100.11.55518: 1706 NXDomain 0/1/0 (160)
23:06:40.477538 IP 192.168.100.11.40996 > c.center-dns.jsinfo.net.domain: 54433+ PTR? 4.b.0.1.4.0.a.7.3.a.4.b.3.a.9.b.0.0.0.0.0.0.0.0.0.0.0.0.0.8.e.f.ip6.arpa. (90)
23:06:40.489796 IP c.center-dns.jsinfo.net.domain > 192.168.100.11.40996: 54433 NXDomain* 0/1/0 (125)
23:06:40.838325 IP 192.168.100.71 > 192.168.100.11: ICMP echo request, id 21532, seq 1916, length 64
23:06:40.838372 IP 192.168.100.11 > 192.168.100.71: ICMP echo reply, id 21532, seq 1916, length 64
23:06:41.839553 IP 192.168.100.71 > 192.168.100.11: ICMP echo request, id 21532, seq 1917, length 64
23:06:41.839599 IP 192.168.100.11 > 192.168.100.71: ICMP echo reply, id 21532, seq 1917, length 64
23:06:42.841570 IP 192.168.100.71 > 192.168.100.11: ICMP echo request, id 21532, seq 1918, length 64
23:06:42.841617 IP 192.168.100.11 > 192.168.100.71: ICMP echo reply, id 21532, seq 1918, length 64
23:06:42.871347 IP 192.168.100.11.60946 > hg-in-f139.1e100.net.https: Flags [.], ack 2705302324, win 368, length 0
23:06:42.871502 IP 192.168.100.11.47348 > c.center-dns.jsinfo.net.domain: 53+ PTR? 139.128.125.74.in-addr.arpa. (45)
23:06:42.883860 IP c.center-dns.jsinfo.net.domain > 192.168.100.11.47348: 53 1/4/4 PTR hg-in-f139.1e100.net. (225)
23:06:42.886934 IP6 fe80::d3:3078:fcb7:2f2.dhcpv6-client > ff02::1:2.dhcpv6-server: dhcp6 solicit
23:06:42.887061 IP 192.168.100.11.35117 > c.center-dns.jsinfo.net.domain: 61776+ PTR? 2.f.2.0.7.b.c.f.8.7.0.3.3.d.0.0.0.0.0.0.0.0.0.0.0.0.0.0.0.8.e.f.ip6.arpa. (90)
23:06:42.898673 IP c.center-dns.jsinfo.net.domain > 192.168.100.11.35117: 61776 NXDomain* 0/1/0 (125)
23:06:42.906008 IP hg-in-f139.1e100.net.https > 192.168.100.11.60946: Flags [.], ack 1, win 661, length 0
23:06:43.842695 IP 192.168.100.71 > 192.168.100.11: ICMP echo request, id 21532, seq 1919, length 64
23:06:43.842739 IP 192.168.100.11 > 192.168.100.71: ICMP echo reply, id 21532, seq 1919, length 64
23:06:44.844792 IP 192.168.100.71 > 192.168.100.11: ICMP echo request, id 21532, seq 1920, length 64
23:06:44.844840 IP 192.168.100.11 > 192.168.100.71: ICMP echo reply, id 21532, seq 1920, length 64
23:06:45.225359 IP 192.168.100.11.39170 > hg-in-f190.1e100.net.https: Flags [S], seq 821607828, win 14600, options [mss 1460,sackOK,TS val 174058536 ecr 0,nop,wscale 7], length 0
23:06:45.476311 IP 192.168.100.11.43543 > hg-in-f136.1e100.net.https: Flags [S], seq 3081861000, win 14600, options [mss 1460,sackOK,TS val 174058787 ecr 0,nop,wscale 7], length 0
23:06:45.846924 IP 192.168.100.71 > 192.168.100.11: ICMP echo request, id 21532, seq 1921, length 64
23:06:45.846970 IP 192.168.100.11 > 192.168.100.71: ICMP echo reply, id 21532, seq 1921, length 64
23:06:46.848190 IP 192.168.100.71 > 192.168.100.11: ICMP echo request, id 21532, seq 1922, length 64
23:06:46.848236 IP 192.168.100.11 > 192.168.100.71: ICMP echo reply, id 21532, seq 1922, length 64
23:06:47.849244 IP 192.168.100.71 > 192.168.100.11: ICMP echo request, id 21532, seq 1923, length 64
23:06:47.849303 IP 192.168.100.11 > 192.168.100.71: ICMP echo reply, id 21532, seq 1923, length 64
23:06:48.850506 IP 192.168.100.71 > 192.168.100.11: ICMP echo request, id 21532, seq 1924, length 64
23:06:48.850554 IP 192.168.100.11 > 192.168.100.71: ICMP echo reply, id 21532, seq 1924, length 64
23:06:49.851539 IP 192.168.100.71 > 192.168.100.11: ICMP echo request, id 21532, seq 1925, length 64
23:06:49.851584 IP 192.168.100.11 > 192.168.100.71: ICMP echo reply, id 21532, seq 1925, length 64
23:06:50.852750 IP 192.168.100.71 > 192.168.100.11: ICMP echo request, id 21532, seq 1926, length 64
23:06:50.852796 IP 192.168.100.11 > 192.168.100.71: ICMP echo reply, id 21532, seq 1926, length 64
23:06:51.853770 IP 192.168.100.71 > 192.168.100.11: ICMP echo request, id 21532, seq 1927, length 64
23:06:51.853818 IP 192.168.100.11 > 192.168.100.71: ICMP echo reply, id 21532, seq 1927, length 64
23:06:52.855045 IP 192.168.100.71 > 192.168.100.11: ICMP echo request, id 21532, seq 1928, length 64
23:06:52.855092 IP 192.168.100.11 > 192.168.100.71: ICMP echo reply, id 21532, seq 1928, length 64
23:06:53.856115 IP 192.168.100.71 > 192.168.100.11: ICMP echo request, id 21532, seq 1929, length 64
23:06:53.856161 IP 192.168.100.11 > 192.168.100.71: ICMP echo reply, id 21532, seq 1929, length 64
23:06:54.858277 IP 192.168.100.71 > 192.168.100.11: ICMP echo request, id 21532, seq 1930, length 64
23:06:54.858337 IP 192.168.100.11 > 192.168.100.71: ICMP echo reply, id 21532, seq 1930, length 64
23:06:54.967306 IP 192.168.100.84.ssdp > 239.255.255.250.ssdp: UDP, length 133
23:06:54.967334 IP 192.168.100.84.ssdp > 239.255.255.250.ssdp: UDP, length 132
23:06:54.967344 IP 192.168.100.84.ssdp > 239.255.255.250.ssdp: UDP, length 137
23:06:54.967488 IP 192.168.100.11.50326 > c.center-dns.jsinfo.net.domain: 54811+ PTR? 250.255.255.239.in-addr.arpa. (46)
23:06:54.967614 IP 192.168.100.84.ssdp > 239.255.255.250.ssdp: UDP, length 101
23:06:54.967629 IP 192.168.100.84.ssdp > 239.255.255.250.ssdp: UDP, length 101
23:06:54.979577 IP c.center-dns.jsinfo.net.domain > 192.168.100.11.50326: 54811 NXDomain 0/1/0 (103)
23:06:54.979724 IP 192.168.100.11.48934 > c.center-dns.jsinfo.net.domain: 24810+ PTR? 84.100.168.192.in-addr.arpa. (45)
23:06:54.990905 IP c.center-dns.jsinfo.net.domain > 192.168.100.11.48934: 24810 NXDomain* 0/1/0 (80)
23:06:55.859344 IP 192.168.100.71 > 192.168.100.11: ICMP echo request, id 21532, seq 1931, length 64
23:06:55.859390 IP 192.168.100.11 > 192.168.100.71: ICMP echo reply, id 21532, seq 1931, length 64
23:06:56.853298 ARP, Request who-has 192.168.100.71 tell 192.168.100.11, length 28
23:06:56.853587 ARP, Reply 192.168.100.71 is-at 52:54:00:59:ff:3e (oui Unknown), length 28
23:06:56.860408 IP 192.168.100.71 > 192.168.100.11: ICMP echo request, id 21532, seq 1932, length 64
23:06:56.860449 IP 192.168.100.11 > 192.168.100.71: ICMP echo reply, id 21532, seq 1932, length 64
23:06:57.862665 IP 192.168.100.71 > 192.168.100.11: ICMP echo request, id 21532, seq 1933, length 64
23:06:57.862712 IP 192.168.100.11 > 192.168.100.71: ICMP echo reply, id 21532, seq 1933, length 64
23:06:58.863854 IP 192.168.100.71 > 192.168.100.11: ICMP echo request, id 21532, seq 1934, length 64
23:06:58.863900 IP 192.168.100.11 > 192.168.100.71: ICMP echo reply, id 21532, seq 1934, length 64
23:06:59.866040 IP 192.168.100.71 > 192.168.100.11: ICMP echo request, id 21532, seq 1935, length 64
23:06:59.866086 IP 192.168.100.11 > 192.168.100.71: ICMP echo reply, id 21532, seq 1935, length 64
23:07:00.867259 IP 192.168.100.71 > 192.168.100.11: ICMP echo request, id 21532, seq 1936, length 64
23:07:00.867319 IP 192.168.100.11 > 192.168.100.71: ICMP echo reply, id 21532, seq 1936, length 64
23:07:01.039627 IP 192.168.100.6.17500 > 255.255.255.255.17500: UDP, length 110
23:07:01.042648 IP 192.168.100.6.17500 > 192.168.103.255.17500: UDP, length 110
23:07:01.225419 IP 192.168.100.11.39170 > hg-in-f190.1e100.net.https: Flags [S], seq 821607828, win 14600, options [mss 1460,sackOK,TS val 174074536 ecr 0,nop,wscale 7], length 0
23:07:01.283239 IP tf-in-f125.1e100.net.xmpp-client > 192.168.100.11.48279: Flags [P.], seq 542:568, ack 413, win 1002, options [nop,nop,TS val 444084296 ecr 174052578], length 26
23:07:01.283281 IP 192.168.100.11.48279 > tf-in-f125.1e100.net.xmpp-client: Flags [.], ack 568, win 501, options [nop,nop,TS val 174074593 ecr 444084296], length 0
23:07:01.476416 IP 192.168.100.11.43543 > hg-in-f136.1e100.net.https: Flags [S], seq 3081861000, win 14600, options [mss 1460,sackOK,TS val 174074787 ecr 0,nop,wscale 7], length 0
23:07:01.673684 IP6 fe80::d3:3078:fcb7:2f2.57006 > ff02::1:3.hostmon: UDP, length 22
23:07:01.673936 IP 192.168.100.11.48796 > c.center-dns.jsinfo.net.domain: 59616+ PTR? 3.0.0.0.1.0.0.0.0.0.0.0.0.0.0.0.0.0.0.0.0.0.0.0.0.0.0.0.2.0.f.f.ip6.arpa. (90)
23:07:01.674222 IP 192.168.100.4.51984 > 224.0.0.252.hostmon: UDP, length 22
23:07:01.677659 IP 192.168.100.4.bootpc > 255.255.255.255.bootps: BOOTP/DHCP, Request from 00:00:02:03:00:00 (oui Unknown), length 300
23:07:01.685545 IP c.center-dns.jsinfo.net.domain > 192.168.100.11.48796: 59616 NXDomain 0/1/0 (160)
23:07:01.685716 IP 192.168.100.11.34668 > c.center-dns.jsinfo.net.domain: 18061+ PTR? 252.0.0.224.in-addr.arpa. (42)
23:07:01.696851 IP c.center-dns.jsinfo.net.domain > 192.168.100.11.34668: 18061 NXDomain 0/1/0 (99)
23:07:01.696988 IP 192.168.100.11.47626 > c.center-dns.jsinfo.net.domain: 37523+ PTR? 4.100.168.192.in-addr.arpa. (44)
23:07:01.708511 IP c.center-dns.jsinfo.net.domain > 192.168.100.11.47626: 37523 NXDomain* 0/1/0 (79)
23:07:01.773763 IP6 fe80::d3:3078:fcb7:2f2.57006 > ff02::1:3.hostmon: UDP, length 22
23:07:01.773799 IP 192.168.100.4.51984 > 224.0.0.252.hostmon: UDP, length 22
23:07:01.868437 IP 192.168.100.71 > 192.168.100.11: ICMP echo request, id 21532, seq 1937, length 64
23:07:01.868472 IP 192.168.100.11 > 192.168.100.71: ICMP echo reply, id 21532, seq 1937, length 64
23:07:01.974123 IP 192.168.100.4.netbios-ns > 192.168.103.255.netbios-ns: NBT UDP PACKET(137): QUERY; REQUEST; BROADCAST
23:07:02.723778 IP 192.168.100.4.netbios-ns > 192.168.103.255.netbios-ns: NBT UDP PACKET(137): QUERY; REQUEST; BROADCAST
23:07:02.869562 IP 192.168.100.71 > 192.168.100.11: ICMP echo request, id 21532, seq 1938, length 64
23:07:02.869601 IP 192.168.100.11 > 192.168.100.71: ICMP echo reply, id 21532, seq 1938, length 64
23:07:03.473734 IP 192.168.100.4.netbios-ns > 192.168.103.255.netbios-ns: NBT UDP PACKET(137): QUERY; REQUEST; BROADCAST
23:07:03.871693 IP 192.168.100.71 > 192.168.100.11: ICMP echo request, id 21532, seq 1939, length 64
23:07:03.871738 IP 192.168.100.11 > 192.168.100.71: ICMP echo reply, id 21532, seq 1939, length 64
23:07:04.873065 IP 192.168.100.71 > 192.168.100.11: ICMP echo request, id 21532, seq 1940, length 64
23:07:04.873111 IP 192.168.100.11 > 192.168.100.71: ICMP echo reply, id 21532, seq 1940, length 64
23:07:05.875143 IP 192.168.100.71 > 192.168.100.11: ICMP echo request, id 21532, seq 1941, length 64
23:07:05.875189 IP 192.168.100.11 > 192.168.100.71: ICMP echo reply, id 21532, seq 1941, length 64
23:07:06.877197 IP 192.168.100.71 > 192.168.100.11: ICMP echo request, id 21532, seq 1942, length 64
23:07:06.877243 IP 192.168.100.11 > 192.168.100.71: ICMP echo reply, id 21532, seq 1942, length 64
23:07:07.879207 IP 192.168.100.71 > 192.168.100.11: ICMP echo request, id 21532, seq 1943, length 64
23:07:07.879252 IP 192.168.100.11 > 192.168.100.71: ICMP echo reply, id 21532, seq 1943, length 64
23:07:08.880424 IP 192.168.100.71 > 192.168.100.11: ICMP echo request, id 21532, seq 1944, length 64
23:07:08.880465 IP 192.168.100.11 > 192.168.100.71: ICMP echo reply, id 21532, seq 1944, length 64
23:07:08.898415 IP 192.168.100.11.37835 > kix01s01-in-f7.1e100.net.http: Flags [.], ack 2935096963, win 124, length 0
23:07:08.898566 IP 192.168.100.11.52867 > c.center-dns.jsinfo.net.domain: 46924+ PTR? 199.235.125.74.in-addr.arpa. (45)
23:07:08.910263 IP c.center-dns.jsinfo.net.domain > 192.168.100.11.52867: 46924 1/4/4 PTR kix01s01-in-f7.1e100.net. (229)
23:07:09.004970 IP kix01s01-in-f7.1e100.net.http > 192.168.100.11.37835: Flags [.], ack 1, win 1000, length 0
23:07:09.770417 IP 192.168.100.11.45365 > kix01s04-in-f9.1e100.net.https: Flags [.], ack 2770514380, win 222, length 0
23:07:09.770577 IP 192.168.100.11.52856 > c.center-dns.jsinfo.net.domain: 64231+ PTR? 41.38.194.173.in-addr.arpa. (44)
23:07:09.781480 IP c.center-dns.jsinfo.net.domain > 192.168.100.11.52856: 64231 1/4/4 PTR kix01s04-in-f9.1e100.net. (228)
23:07:09.852832 IP kix01s04-in-f9.1e100.net.https > 192.168.100.11.45365: Flags [.], ack 1, win 1002, length 0
23:07:09.882523 IP 192.168.100.71 > 192.168.100.11: ICMP echo request, id 21532, seq 1945, length 64
23:07:09.882556 IP 192.168.100.11 > 192.168.100.71: ICMP echo reply, id 21532, seq 1945, length 64
23:07:10.884608 IP 192.168.100.71 > 192.168.100.11: ICMP echo request, id 21532, seq 1946, length 64
23:07:10.884654 IP 192.168.100.11 > 192.168.100.71: ICMP echo reply, id 21532, seq 1946, length 64
23:07:11.885659 IP 192.168.100.71 > 192.168.100.11: ICMP echo request, id 21532, seq 1947, length 64
23:07:11.885706 IP 192.168.100.11 > 192.168.100.71: ICMP echo reply, id 21532, seq 1947, length 64
23:07:12.468191 IP6 fe80::b9a3:b4a3:7a04:10b4.dhcpv6-client > ff02::1:2.dhcpv6-server: dhcp6 solicit
23:07:12.886909 IP 192.168.100.71 > 192.168.100.11: ICMP echo request, id 21532, seq 1948, length 64
23:07:12.886954 IP 192.168.100.11 > 192.168.100.71: ICMP echo reply, id 21532, seq 1948, length 64
23:07:13.888008 IP 192.168.100.71 > 192.168.100.11: ICMP echo request, id 21532, seq 1949, length 64
23:07:13.888075 IP 192.168.100.11 > 192.168.100.71: ICMP echo reply, id 21532, seq 1949, length 64
23:07:14.889081 IP 192.168.100.71 > 192.168.100.11: ICMP echo request, id 21532, seq 1950, length 64
23:07:14.889129 IP 192.168.100.11 > 192.168.100.71: ICMP echo reply, id 21532, seq 1950, length 64
23:07:15.757227 IP 192.168.100.6.5997 > 255.255.255.255.5998: UDP, length 12
23:07:15.890224 IP 192.168.100.71 > 192.168.100.11: ICMP echo request, id 21532, seq 1951, length 64
23:07:15.890263 IP 192.168.100.11 > 192.168.100.71: ICMP echo reply, id 21532, seq 1951, length 64
23:07:16.892307 IP 192.168.100.71 > 192.168.100.11: ICMP echo request, id 21532, seq 1952, length 64
23:07:16.892354 IP 192.168.100.11 > 192.168.100.71: ICMP echo reply, id 21532, seq 1952, length 64
23:07:17.893439 IP 192.168.100.71 > 192.168.100.11: ICMP echo request, id 21532, seq 1953, length 64
23:07:17.893493 IP 192.168.100.11 > 192.168.100.71: ICMP echo reply, id 21532, seq 1953, length 64
23:07:18.895442 IP 192.168.100.71 > 192.168.100.11: ICMP echo request, id 21532, seq 1954, length 64
23:07:18.895488 IP 192.168.100.11 > 192.168.100.71: ICMP echo reply, id 21532, seq 1954, length 64
23:07:19.249264 IP6 fe80::d3:3078:fcb7:2f2.56349 > ff02::1:3.hostmon: UDP, length 22
23:07:19.249374 IP 192.168.100.4.55298 > 224.0.0.252.hostmon: UDP, length 22
23:07:19.349597 IP6 fe80::d3:3078:fcb7:2f2.56349 > ff02::1:3.hostmon: UDP, length 22
23:07:19.349637 IP 192.168.100.4.55298 > 224.0.0.252.hostmon: UDP, length 22
23:07:19.550016 IP 192.168.100.4.netbios-ns > 192.168.103.255.netbios-ns: NBT UDP PACKET(137): QUERY; REQUEST; BROADCAST
23:07:19.897432 IP 192.168.100.71 > 192.168.100.11: ICMP echo request, id 21532, seq 1955, length 64
23:07:19.897474 IP 192.168.100.11 > 192.168.100.71: ICMP echo reply, id 21532, seq 1955, length 64
23:07:20.299718 IP 192.168.100.4.netbios-ns > 192.168.103.255.netbios-ns: NBT UDP PACKET(137): QUERY; REQUEST; BROADCAST
23:07:20.898674 IP 192.168.100.71 > 192.168.100.11: ICMP echo request, id 21532, seq 1956, length 64
23:07:20.898721 IP 192.168.100.11 > 192.168.100.71: ICMP echo reply, id 21532, seq 1956, length 64
23:07:21.049692 IP 192.168.100.4.netbios-ns > 192.168.103.255.netbios-ns: NBT UDP PACKET(137): QUERY; REQUEST; BROADCAST
23:07:21.899762 IP 192.168.100.71 > 192.168.100.11: ICMP echo request, id 21532, seq 1957, length 64
23:07:21.899807 IP 192.168.100.11 > 192.168.100.71: ICMP echo reply, id 21532, seq 1957, length 64
23:07:22.525582 IP6 fe80::21a:6bff:fe38:205c.mdns > ff02::fb.mdns: 0 PTR (QM)? 42.101.168.192.in-addr.arpa. (45)
23:07:22.525646 IP 192.168.100.62.mdns > 224.0.0.251.mdns: 0 PTR (QM)? 42.101.168.192.in-addr.arpa. (45)
23:07:22.525843 IP 192.168.100.11.55053 > c.center-dns.jsinfo.net.domain: 18420+ PTR? b.f.0.0.0.0.0.0.0.0.0.0.0.0.0.0.0.0.0.0.0.0.0.0.0.0.0.0.2.0.f.f.ip6.arpa. (90)
23:07:22.537865 IP c.center-dns.jsinfo.net.domain > 192.168.100.11.55053: 18420 NXDomain 0/1/0 (160)
23:07:22.538016 IP 192.168.100.11.49302 > c.center-dns.jsinfo.net.domain: 17266+ PTR? c.5.0.2.8.3.e.f.f.f.b.6.a.1.2.0.0.0.0.0.0.0.0.0.0.0.0.0.0.8.e.f.ip6.arpa. (90)
23:07:22.549005 IP c.center-dns.jsinfo.net.domain > 192.168.100.11.49302: 17266 NXDomain* 0/1/0 (125)
23:07:22.549158 IP 192.168.100.11.59192 > c.center-dns.jsinfo.net.domain: 19919+ PTR? 251.0.0.224.in-addr.arpa. (42)
23:07:22.560892 IP c.center-dns.jsinfo.net.domain > 192.168.100.11.59192: 19919 NXDomain 0/1/0 (99)
23:07:22.561032 IP 192.168.100.11.49538 > c.center-dns.jsinfo.net.domain: 39465+ PTR? 62.100.168.192.in-addr.arpa. (45)
23:07:22.571017 IP c.center-dns.jsinfo.net.domain > 192.168.100.11.49538: 39465 NXDomain* 0/1/0 (80)
23:07:22.900955 IP 192.168.100.71 > 192.168.100.11: ICMP echo request, id 21532, seq 1958, length 64
23:07:22.901001 IP 192.168.100.11 > 192.168.100.71: ICMP echo reply, id 21532, seq 1958, length 64
23:07:23.526642 IP6 fe80::21a:6bff:fe38:205c.mdns > ff02::fb.mdns: 0 PTR (QM)? 42.101.168.192.in-addr.arpa. (45)
23:07:23.526687 IP 192.168.100.62.mdns > 224.0.0.251.mdns: 0 PTR (QM)? 42.101.168.192.in-addr.arpa. (45)
23:07:23.903148 IP 192.168.100.71 > 192.168.100.11: ICMP echo request, id 21532, seq 1959, length 64
23:07:23.903195 IP 192.168.100.11 > 192.168.100.71: ICMP echo reply, id 21532, seq 1959, length 64
23:07:24.083473 IP 192.168.100.85.ssdp > 239.255.255.250.ssdp: UDP, length 133
23:07:24.083504 IP 192.168.100.85.ssdp > 239.255.255.250.ssdp: UDP, length 132
23:07:24.083514 IP 192.168.100.85.ssdp > 239.255.255.250.ssdp: UDP, length 137
23:07:24.083522 IP 192.168.100.85.ssdp > 239.255.255.250.ssdp: UDP, length 101
23:07:24.083531 IP 192.168.100.85.ssdp > 239.255.255.250.ssdp: UDP, length 101
23:07:24.083675 IP 192.168.100.11.57371 > c.center-dns.jsinfo.net.domain: 60068+ PTR? 85.100.168.192.in-addr.arpa. (45)
23:07:24.094173 IP c.center-dns.jsinfo.net.domain > 192.168.100.11.57371: 60068 NXDomain* 0/1/0 (80)
23:07:24.227376 IP 192.168.100.11.41177 > kix01s01-in-f8.1e100.net.https: Flags [.], ack 8206, win 501, length 0
23:07:24.312115 IP kix01s01-in-f8.1e100.net.https > 192.168.100.11.41177: Flags [.], ack 3701, win 1002, length 0
23:07:24.905263 IP 192.168.100.71 > 192.168.100.11: ICMP echo request, id 21532, seq 1960, length 64
23:07:24.905322 IP 192.168.100.11 > 192.168.100.71: ICMP echo reply, id 21532, seq 1960, length 64
23:07:25.528798 IP6 fe80::21a:6bff:fe38:205c.mdns > ff02::fb.mdns: 0 PTR (QM)? 42.101.168.192.in-addr.arpa. (45)
23:07:25.528843 IP 192.168.100.62.mdns > 224.0.0.251.mdns: 0 PTR (QM)? 42.101.168.192.in-addr.arpa. (45)
23:07:25.906374 IP 192.168.100.71 > 192.168.100.11: ICMP echo request, id 21532, seq 1961, length 64
23:07:25.906419 IP 192.168.100.11 > 192.168.100.71: ICMP echo reply, id 21532, seq 1961, length 64
23:07:26.907688 IP 192.168.100.71 > 192.168.100.11: ICMP echo request, id 21532, seq 1962, length 64
23:07:26.907734 IP 192.168.100.11 > 192.168.100.71: ICMP echo reply, id 21532, seq 1962, length 64
23:07:27.525406 ARP, Request who-has 192.168.100.254 tell 192.168.100.11, length 28
23:07:27.525581 IP 192.168.100.11.53894 > c.center-dns.jsinfo.net.domain: 48701+ PTR? 254.100.168.192.in-addr.arpa. (46)
23:07:27.527083 ARP, Reply 192.168.100.254 is-at 54:75:d0:28:3f:4b (oui Unknown), length 46
23:07:27.536384 IP c.center-dns.jsinfo.net.domain > 192.168.100.11.53894: 48701 NXDomain* 0/1/0 (81)
23:07:27.905420 IP 192.168.100.11.60946 > hg-in-f139.1e100.net.https: Flags [.], ack 1, win 368, length 0
23:07:27.909753 IP 192.168.100.71 > 192.168.100.11: ICMP echo request, id 21532, seq 1963, length 64
23:07:27.909790 IP 192.168.100.11 > 192.168.100.71: ICMP echo reply, id 21532, seq 1963, length 64
23:07:27.938738 IP hg-in-f139.1e100.net.https > 192.168.100.11.60946: Flags [.], ack 1, win 661, length 0
23:07:28.910966 IP 192.168.100.71 > 192.168.100.11: ICMP echo request, id 21532, seq 1964, length 64
23:07:28.911013 IP 192.168.100.11 > 192.168.100.71: ICMP echo reply, id 21532, seq 1964, length 64
23:07:29.912136 IP 192.168.100.71 > 192.168.100.11: ICMP echo request, id 21532, seq 1965, length 64
23:07:29.912177 IP 192.168.100.11 > 192.168.100.71: ICMP echo reply, id 21532, seq 1965, length 64
23:07:30.913363 IP 192.168.100.71 > 192.168.100.11: ICMP echo request, id 21532, seq 1966, length 64
23:07:30.913410 IP 192.168.100.11 > 192.168.100.71: ICMP echo reply, id 21532, seq 1966, length 64
23:07:31.056540 IP 192.168.100.6.17500 > 255.255.255.255.17500: UDP, length 110
23:07:31.059783 IP 192.168.100.6.17500 > 192.168.103.255.17500: UDP, length 110
23:07:31.914496 IP 192.168.100.71 > 192.168.100.11: ICMP echo request, id 21532, seq 1967, length 64
23:07:31.914542 IP 192.168.100.11 > 192.168.100.71: ICMP echo reply, id 21532, seq 1967, length 64
23:07:32.195407 IP 192.168.100.4.57440 > 239.255.255.250.ssdp: UDP, length 133
23:07:32.195438 IP 192.168.100.4.57440 > 239.255.255.250.ssdp: UDP, length 132
23:07:32.915701 IP 192.168.100.71 > 192.168.100.11: ICMP echo request, id 21532, seq 1968, length 64
23:07:32.915747 IP 192.168.100.11 > 192.168.100.71: ICMP echo reply, id 21532, seq 1968, length 64
23:07:33.225525 IP 192.168.100.11.52285 > hg-in-f93.1e100.net.https: Flags [S], seq 4193157541, win 14600, options [mss 1460,sackOK,TS val 174106536 ecr 0,nop,wscale 7], length 0
23:07:33.225696 IP 192.168.100.11.35057 > c.center-dns.jsinfo.net.domain: 39579+ PTR? 93.128.125.74.in-addr.arpa. (44)
23:07:33.237176 IP c.center-dns.jsinfo.net.domain > 192.168.100.11.35057: 39579 1/4/4 PTR hg-in-f93.1e100.net. (223)
23:07:33.476548 IP 192.168.100.11.39173 > hg-in-f190.1e100.net.https: Flags [S], seq 1687817750, win 14600, options [mss 1460,sackOK,TS val 174106787 ecr 0,nop,wscale 7], length 0
23:07:33.917675 IP 192.168.100.71 > 192.168.100.11: ICMP echo request, id 21532, seq 1969, length 64
23:07:33.917721 IP 192.168.100.11 > 192.168.100.71: ICMP echo reply, id 21532, seq 1969, length 64
23:07:34.196604 IP 192.168.100.4.57440 > 239.255.255.250.ssdp: UDP, length 133
23:07:34.196636 IP 192.168.100.4.57440 > 239.255.255.250.ssdp: UDP, length 132
23:07:34.225345 IP 192.168.100.11.52285 > hg-in-f93.1e100.net.https: Flags [S], seq 4193157541, win 14600, options [mss 1460,sackOK,TS val 174107536 ecr 0,nop,wscale 7], length 0
23:07:34.476352 IP 192.168.100.11.39173 > hg-in-f190.1e100.net.https: Flags [S], seq 1687817750, win 14600, options [mss 1460,sackOK,TS val 174107787 ecr 0,nop,wscale 7], length 0
23:07:34.918723 IP 192.168.100.71 > 192.168.100.11: ICMP echo request, id 21532, seq 1970, length 64
23:07:34.918769 IP 192.168.100.11 > 192.168.100.71: ICMP echo reply, id 21532, seq 1970, length 64
23:07:35.919925 IP 192.168.100.71 > 192.168.100.11: ICMP echo request, id 21532, seq 1971, length 64
23:07:35.919972 IP 192.168.100.11 > 192.168.100.71: ICMP echo reply, id 21532, seq 1971, length 64
23:07:36.196764 IP 192.168.100.4.57440 > 239.255.255.250.ssdp: UDP, length 133
23:07:36.196797 IP 192.168.100.4.57440 > 239.255.255.250.ssdp: UDP, length 132
23:07:36.225419 IP 192.168.100.11.52285 > hg-in-f93.1e100.net.https: Flags [S], seq 4193157541, win 14600, options [mss 1460,sackOK,TS val 174109536 ecr 0,nop,wscale 7], length 0
23:07:36.476353 IP 192.168.100.11.39173 > hg-in-f190.1e100.net.https: Flags [S], seq 1687817750, win 14600, options [mss 1460,sackOK,TS val 174109787 ecr 0,nop,wscale 7], length 0
23:07:36.865191 IP6 fe80::d3:3078:fcb7:2f2.53499 > ff02::1:3.hostmon: UDP, length 22
23:07:36.865551 IP 192.168.100.4.57584 > 224.0.0.252.hostmon: UDP, length 22
23:07:36.921264 IP 192.168.100.71 > 192.168.100.11: ICMP echo request, id 21532, seq 1972, length 64
23:07:36.921318 IP 192.168.100.11 > 192.168.100.71: ICMP echo reply, id 21532, seq 1972, length 64
23:07:36.965649 IP6 fe80::d3:3078:fcb7:2f2.53499 > ff02::1:3.hostmon: UDP, length 22
23:07:36.965685 IP 192.168.100.4.57584 > 224.0.0.252.hostmon: UDP, length 22
23:07:37.165776 IP 192.168.100.4.netbios-ns > 192.168.103.255.netbios-ns: NBT UDP PACKET(137): QUERY; REQUEST; BROADCAST
23:07:37.915601 IP 192.168.100.4.netbios-ns > 192.168.103.255.netbios-ns: NBT UDP PACKET(137): QUERY; REQUEST; BROADCAST
23:07:37.922406 IP 192.168.100.71 > 192.168.100.11: ICMP echo request, id 21532, seq 1973, length 64
23:07:37.922441 IP 192.168.100.11 > 192.168.100.71: ICMP echo reply, id 21532, seq 1973, length 64
23:07:38.665660 IP 192.168.100.4.netbios-ns > 192.168.103.255.netbios-ns: NBT UDP PACKET(137): QUERY; REQUEST; BROADCAST
23:07:38.923531 IP 192.168.100.71 > 192.168.100.11: ICMP echo request, id 21532, seq 1974, length 64
23:07:38.923571 IP 192.168.100.11 > 192.168.100.71: ICMP echo reply, id 21532, seq 1974, length 64
23:07:39.925549 IP 192.168.100.71 > 192.168.100.11: ICMP echo request, id 21532, seq 1975, length 64
23:07:39.925598 IP 192.168.100.11 > 192.168.100.71: ICMP echo reply, id 21532, seq 1975, length 64
23:07:40.225424 IP 192.168.100.11.52285 > hg-in-f93.1e100.net.https: Flags [S], seq 4193157541, win 14600, options [mss 1460,sackOK,TS val 174113536 ecr 0,nop,wscale 7], length 0
23:07:40.476417 IP 192.168.100.11.39173 > hg-in-f190.1e100.net.https: Flags [S], seq 1687817750, win 14600, options [mss 1460,sackOK,TS val 174113787 ecr 0,nop,wscale 7], length 0
23:07:40.926655 IP 192.168.100.71 > 192.168.100.11: ICMP echo request, id 21532, seq 1976, length 64
23:07:40.926703 IP 192.168.100.11 > 192.168.100.71: ICMP echo reply, id 21532, seq 1976, length 64
23:07:41.551217 ARP, Request who-has 192.168.100.254 tell 192.168.100.86, length 46
23:07:41.551426 IP 192.168.100.11.46826 > c.center-dns.jsinfo.net.domain: 52879+ PTR? 86.100.168.192.in-addr.arpa. (45)
23:07:41.562262 IP c.center-dns.jsinfo.net.domain > 192.168.100.11.46826: 52879 NXDomain* 0/1/0 (80)
23:07:41.928746 IP 192.168.100.71 > 192.168.100.11: ICMP echo request, id 21532, seq 1977, length 64
23:07:41.928792 IP 192.168.100.11 > 192.168.100.71: ICMP echo reply, id 21532, seq 1977, length 64
23:07:42.930065 IP 192.168.100.71 > 192.168.100.11: ICMP echo request, id 21532, seq 1978, length 64
23:07:42.930112 IP 192.168.100.11 > 192.168.100.71: ICMP echo reply, id 21532, seq 1978, length 64
23:07:43.932029 IP 192.168.100.71 > 192.168.100.11: ICMP echo request, id 21532, seq 1979, length 64
23:07:43.932076 IP 192.168.100.11 > 192.168.100.71: ICMP echo reply, id 21532, seq 1979, length 64
23:07:44.925407 ARP, Request who-has 192.168.100.71 tell 192.168.100.11, length 28
23:07:44.925742 ARP, Reply 192.168.100.71 is-at 52:54:00:59:ff:3e (oui Unknown), length 28
23:07:44.933090 IP 192.168.100.71 > 192.168.100.11: ICMP echo request, id 21532, seq 1980, length 64
23:07:44.933131 IP 192.168.100.11 > 192.168.100.71: ICMP echo reply, id 21532, seq 1980, length 64
23:07:45.935167 IP 192.168.100.71 > 192.168.100.11: ICMP echo request, id 21532, seq 1981, length 64
23:07:45.935212 IP 192.168.100.11 > 192.168.100.71: ICMP echo reply, id 21532, seq 1981, length 64
23:07:46.282352 IP 192.168.100.11.48279 > tf-in-f125.1e100.net.xmpp-client: Flags [.], ack 568, win 501, options [nop,nop,TS val 174119593 ecr 444084296], length 0
23:07:46.340538 IP tf-in-f125.1e100.net.xmpp-client > 192.168.100.11.48279: Flags [.], ack 413, win 1002, options [nop,nop,TS val 444129372 ecr 174074593], length 0
23:07:46.936501 IP 192.168.100.71 > 192.168.100.11: ICMP echo request, id 21532, seq 1982, length 64
23:07:46.936547 IP 192.168.100.11 > 192.168.100.71: ICMP echo reply, id 21532, seq 1982, length 64
23:07:47.937619 IP 192.168.100.71 > 192.168.100.11: ICMP echo request, id 21532, seq 1983, length 64
23:07:47.937661 IP 192.168.100.11 > 192.168.100.71: ICMP echo reply, id 21532, seq 1983, length 64
23:07:48.225423 IP 192.168.100.11.52285 > hg-in-f93.1e100.net.https: Flags [S], seq 4193157541, win 14600, options [mss 1460,sackOK,TS val 174121536 ecr 0,nop,wscale 7], length 0
23:07:48.476420 IP 192.168.100.11.39173 > hg-in-f190.1e100.net.https: Flags [S], seq 1687817750, win 14600, options [mss 1460,sackOK,TS val 174121787 ecr 0,nop,wscale 7], length 0
23:07:48.938617 IP 192.168.100.71 > 192.168.100.11: ICMP echo request, id 21532, seq 1984, length 64
23:07:48.938664 IP 192.168.100.11 > 192.168.100.71: ICMP echo reply, id 21532, seq 1984, length 64
23:07:49.939594 IP 192.168.100.71 > 192.168.100.11: ICMP echo request, id 21532, seq 1985, length 64
23:07:49.939640 IP 192.168.100.11 > 192.168.100.71: ICMP echo reply, id 21532, seq 1985, length 64
23:07:50.941425 IP 192.168.100.71 > 192.168.100.11: ICMP echo request, id 21532, seq 1986, length 64
23:07:50.941471 IP 192.168.100.11 > 192.168.100.71: ICMP echo reply, id 21532, seq 1986, length 64
23:07:51.943606 IP 192.168.100.71 > 192.168.100.11: ICMP echo request, id 21532, seq 1987, length 64
23:07:51.943653 IP 192.168.100.11 > 192.168.100.71: ICMP echo reply, id 21532, seq 1987, length 64
23:07:52.944830 IP 192.168.100.71 > 192.168.100.11: ICMP echo request, id 21532, seq 1988, length 64
23:07:52.944877 IP 192.168.100.11 > 192.168.100.71: ICMP echo reply, id 21532, seq 1988, length 64
23:07:53.946906 IP 192.168.100.71 > 192.168.100.11: ICMP echo request, id 21532, seq 1989, length 64
23:07:53.946952 IP 192.168.100.11 > 192.168.100.71: ICMP echo reply, id 21532, seq 1989, length 64
23:07:54.004341 IP 192.168.100.11.37835 > kix01s01-in-f7.1e100.net.http: Flags [.], ack 1, win 124, length 0
23:07:54.090450 IP kix01s01-in-f7.1e100.net.http > 192.168.100.11.37835: Flags [.], ack 1, win 1000, length 0
23:07:54.852350 IP 192.168.100.11.45365 > kix01s04-in-f9.1e100.net.https: Flags [.], ack 1, win 222, length 0
