23:17:54.796865 IP 192.168.100.71 > 192.168.100.11: ICMP echo request, id 21532, seq 2589, length 64
23:17:54.796913 IP 192.168.100.11 > 192.168.100.71: ICMP echo reply, id 21532, seq 2589, length 64
23:17:54.797447 IP 192.168.100.11.42197 > c.center-dns.jsinfo.net.domain: 31465+ PTR? 11.100.168.192.in-addr.arpa. (45)
23:17:54.807744 IP c.center-dns.jsinfo.net.domain > 192.168.100.11.42197: 31465 NXDomain* 0/1/0 (80)
23:17:54.807933 IP 192.168.100.11.35330 > c.center-dns.jsinfo.net.domain: 6303+ PTR? 71.100.168.192.in-addr.arpa. (45)
23:17:54.819664 IP c.center-dns.jsinfo.net.domain > 192.168.100.11.35330: 6303 NXDomain* 0/1/0 (80)
23:17:54.819854 IP 192.168.100.11.58505 > c.center-dns.jsinfo.net.domain: 26458+ PTR? 1.7.177.61.in-addr.arpa. (41)
23:17:54.830497 IP c.center-dns.jsinfo.net.domain > 192.168.100.11.58505: 26458 1/2/2 PTR c.center-dns.jsinfo.net. (153)
23:17:55.122019 IP 192.168.100.84.ssdp > 239.255.255.250.ssdp: UDP, length 133
23:17:55.122054 IP 192.168.100.84.ssdp > 239.255.255.250.ssdp: UDP, length 132
23:17:55.122065 IP 192.168.100.84.ssdp > 239.255.255.250.ssdp: UDP, length 137
23:17:55.122208 IP 192.168.100.84.ssdp > 239.255.255.250.ssdp: UDP, length 101
23:17:55.122222 IP 192.168.100.84.ssdp > 239.255.255.250.ssdp: UDP, length 101
23:17:55.122255 IP 192.168.100.11.48385 > c.center-dns.jsinfo.net.domain: 55067+ PTR? 250.255.255.239.in-addr.arpa. (46)
23:17:55.134159 IP c.center-dns.jsinfo.net.domain > 192.168.100.11.48385: 55067 NXDomain 0/1/0 (103)
23:17:55.134348 IP 192.168.100.11.58094 > c.center-dns.jsinfo.net.domain: 47882+ PTR? 84.100.168.192.in-addr.arpa. (45)
23:17:55.145697 IP c.center-dns.jsinfo.net.domain > 192.168.100.11.58094: 47882 NXDomain* 0/1/0 (80)
23:17:55.798352 IP 192.168.100.71 > 192.168.100.11: ICMP echo request, id 21532, seq 2590, length 64
23:17:55.798400 IP 192.168.100.11 > 192.168.100.71: ICMP echo reply, id 21532, seq 2590, length 64
23:17:56.799735 IP 192.168.100.71 > 192.168.100.11: ICMP echo request, id 21532, seq 2591, length 64
23:17:56.799782 IP 192.168.100.11 > 192.168.100.71: ICMP echo reply, id 21532, seq 2591, length 64
23:17:57.800969 IP 192.168.100.71 > 192.168.100.11: ICMP echo request, id 21532, seq 2592, length 64
23:17:57.801018 IP 192.168.100.11 > 192.168.100.71: ICMP echo reply, id 21532, seq 2592, length 64
23:17:58.802154 IP 192.168.100.71 > 192.168.100.11: ICMP echo request, id 21532, seq 2593, length 64
23:17:58.802203 IP 192.168.100.11 > 192.168.100.71: ICMP echo reply, id 21532, seq 2593, length 64
23:17:59.803561 IP 192.168.100.71 > 192.168.100.11: ICMP echo request, id 21532, seq 2594, length 64
23:17:59.803610 IP 192.168.100.11 > 192.168.100.71: ICMP echo reply, id 21532, seq 2594, length 64
23:18:00.804775 IP 192.168.100.71 > 192.168.100.11: ICMP echo request, id 21532, seq 2595, length 64
23:18:00.804825 IP 192.168.100.11 > 192.168.100.71: ICMP echo reply, id 21532, seq 2595, length 64
23:18:01.413333 IP 192.168.100.6.17500 > 255.255.255.255.17500: UDP, length 110
23:18:01.413541 IP 192.168.100.11.36689 > c.center-dns.jsinfo.net.domain: 26877+ PTR? 255.255.255.255.in-addr.arpa. (46)
23:18:01.416212 IP 192.168.100.6.17500 > 192.168.103.255.17500: UDP, length 110
23:18:01.424458 IP c.center-dns.jsinfo.net.domain > 192.168.100.11.36689: 26877* 0/1/0 (81)
23:18:01.424607 IP 192.168.100.11.43653 > c.center-dns.jsinfo.net.domain: 13888+ PTR? 6.100.168.192.in-addr.arpa. (44)
23:18:01.435175 IP c.center-dns.jsinfo.net.domain > 192.168.100.11.43653: 13888 NXDomain* 0/1/0 (79)
23:18:01.435356 IP 192.168.100.11.33857 > c.center-dns.jsinfo.net.domain: 44944+ PTR? 255.103.168.192.in-addr.arpa. (46)
23:18:01.447144 IP c.center-dns.jsinfo.net.domain > 192.168.100.11.33857: 44944 NXDomain* 0/1/0 (81)
23:18:01.805902 IP 192.168.100.71 > 192.168.100.11: ICMP echo request, id 21532, seq 2596, length 64
23:18:01.805947 IP 192.168.100.11 > 192.168.100.71: ICMP echo reply, id 21532, seq 2596, length 64
23:18:02.807102 IP 192.168.100.71 > 192.168.100.11: ICMP echo request, id 21532, seq 2597, length 64
23:18:02.807153 IP 192.168.100.11 > 192.168.100.71: ICMP echo reply, id 21532, seq 2597, length 64
23:18:03.809132 IP 192.168.100.71 > 192.168.100.11: ICMP echo request, id 21532, seq 2598, length 64
23:18:03.809183 IP 192.168.100.11 > 192.168.100.71: ICMP echo reply, id 21532, seq 2598, length 64
23:18:04.810365 IP 192.168.100.71 > 192.168.100.11: ICMP echo request, id 21532, seq 2599, length 64
23:18:04.810414 IP 192.168.100.11 > 192.168.100.71: ICMP echo reply, id 21532, seq 2599, length 64
23:18:05.804405 ARP, Request who-has 192.168.100.71 tell 192.168.100.11, length 28
23:18:05.804771 ARP, Reply 192.168.100.71 is-at 52:54:00:59:ff:3e (oui Unknown), length 28
23:18:05.811554 IP 192.168.100.71 > 192.168.100.11: ICMP echo request, id 21532, seq 2600, length 64
23:18:05.811597 IP 192.168.100.11 > 192.168.100.71: ICMP echo reply, id 21532, seq 2600, length 64
23:18:06.413401 ARP, Request who-has 192.168.100.254 tell 192.168.100.11, length 28
23:18:06.413565 IP 192.168.100.11.38092 > c.center-dns.jsinfo.net.domain: 28187+ PTR? 254.100.168.192.in-addr.arpa. (46)
23:18:06.415101 ARP, Reply 192.168.100.254 is-at 54:75:d0:28:3f:4b (oui Unknown), length 46
23:18:06.425532 IP c.center-dns.jsinfo.net.domain > 192.168.100.11.38092: 28187 NXDomain* 0/1/0 (81)
23:18:06.812810 IP 192.168.100.71 > 192.168.100.11: ICMP echo request, id 21532, seq 2601, length 64
23:18:06.812853 IP 192.168.100.11 > 192.168.100.71: ICMP echo reply, id 21532, seq 2601, length 64
23:18:07.107424 IP6 fe80::6dac:7dfc:cbe8:95ee.dhcpv6-client > ff02::1:2.dhcpv6-server: dhcp6 solicit
23:18:07.107644 IP 192.168.100.11.34720 > c.center-dns.jsinfo.net.domain: 12317+ PTR? 2.0.0.0.1.0.0.0.0.0.0.0.0.0.0.0.0.0.0.0.0.0.0.0.0.0.0.0.2.0.f.f.ip6.arpa. (90)
23:18:07.119345 IP c.center-dns.jsinfo.net.domain > 192.168.100.11.34720: 12317 NXDomain 0/1/0 (160)
23:18:07.119501 IP 192.168.100.11.42059 > c.center-dns.jsinfo.net.domain: 46608+ PTR? e.e.5.9.8.e.b.c.c.f.d.7.c.a.d.6.0.0.0.0.0.0.0.0.0.0.0.0.0.8.e.f.ip6.arpa. (90)
23:18:07.130946 IP c.center-dns.jsinfo.net.domain > 192.168.100.11.42059: 46608 NXDomain* 0/1/0 (125)
23:18:07.814975 IP 192.168.100.71 > 192.168.100.11: ICMP echo request, id 21532, seq 2602, length 64
23:18:07.815024 IP 192.168.100.11 > 192.168.100.71: ICMP echo reply, id 21532, seq 2602, length 64
23:18:08.816180 IP 192.168.100.71 > 192.168.100.11: ICMP echo request, id 21532, seq 2603, length 64
23:18:08.816228 IP 192.168.100.11 > 192.168.100.71: ICMP echo reply, id 21532, seq 2603, length 64
23:18:09.817219 IP 192.168.100.71 > 192.168.100.11: ICMP echo request, id 21532, seq 2604, length 64
23:18:09.817269 IP 192.168.100.11 > 192.168.100.71: ICMP echo reply, id 21532, seq 2604, length 64
23:18:10.818636 IP 192.168.100.71 > 192.168.100.11: ICMP echo request, id 21532, seq 2605, length 64
23:18:10.818683 IP 192.168.100.11 > 192.168.100.71: ICMP echo reply, id 21532, seq 2605, length 64
23:18:11.820020 IP 192.168.100.71 > 192.168.100.11: ICMP echo request, id 21532, seq 2606, length 64
23:18:11.820068 IP 192.168.100.11 > 192.168.100.71: ICMP echo reply, id 21532, seq 2606, length 64
23:18:12.821521 IP 192.168.100.71 > 192.168.100.11: ICMP echo request, id 21532, seq 2607, length 64
23:18:12.821569 IP 192.168.100.11 > 192.168.100.71: ICMP echo reply, id 21532, seq 2607, length 64
23:18:13.822423 IP 192.168.100.71 > 192.168.100.11: ICMP echo request, id 21532, seq 2608, length 64
23:18:13.822474 IP 192.168.100.11 > 192.168.100.71: ICMP echo reply, id 21532, seq 2608, length 64
23:18:14.824207 IP 192.168.100.71 > 192.168.100.11: ICMP echo request, id 21532, seq 2609, length 64
23:18:14.824255 IP 192.168.100.11 > 192.168.100.71: ICMP echo reply, id 21532, seq 2609, length 64
23:18:15.825432 IP 192.168.100.71 > 192.168.100.11: ICMP echo request, id 21532, seq 2610, length 64
23:18:15.825476 IP 192.168.100.11 > 192.168.100.71: ICMP echo reply, id 21532, seq 2610, length 64
23:18:15.912982 IP 192.168.100.6.5997 > 255.255.255.255.5998: UDP, length 12
23:18:16.826681 IP 192.168.100.71 > 192.168.100.11: ICMP echo request, id 21532, seq 2611, length 64
23:18:16.826728 IP 192.168.100.11 > 192.168.100.71: ICMP echo reply, id 21532, seq 2611, length 64
23:18:17.827847 IP 192.168.100.71 > 192.168.100.11: ICMP echo request, id 21532, seq 2612, length 64
23:18:17.827893 IP 192.168.100.11 > 192.168.100.71: ICMP echo reply, id 21532, seq 2612, length 64
23:18:18.319106 IP 192.168.100.4.bootpc > 255.255.255.255.bootps: BOOTP/DHCP, Request from 00:00:02:03:00:00 (oui Unknown), length 300
23:18:18.319336 IP 192.168.100.11.57176 > c.center-dns.jsinfo.net.domain: 4388+ PTR? 4.100.168.192.in-addr.arpa. (44)
23:18:18.322831 IP6 fe80::d3:3078:fcb7:2f2.63147 > ff02::1:3.hostmon: UDP, length 22
23:18:18.322920 IP 192.168.100.4.62971 > 224.0.0.252.hostmon: UDP, length 22
23:18:18.330054 IP c.center-dns.jsinfo.net.domain > 192.168.100.11.57176: 4388 NXDomain* 0/1/0 (79)
23:18:18.330310 IP 192.168.100.11.39087 > c.center-dns.jsinfo.net.domain: 1180+ PTR? 3.0.0.0.1.0.0.0.0.0.0.0.0.0.0.0.0.0.0.0.0.0.0.0.0.0.0.0.2.0.f.f.ip6.arpa. (90)
23:18:18.340665 IP c.center-dns.jsinfo.net.domain > 192.168.100.11.39087: 1180 NXDomain 0/1/0 (160)
23:18:18.340831 IP 192.168.100.11.57719 > c.center-dns.jsinfo.net.domain: 1860+ PTR? 2.f.2.0.7.b.c.f.8.7.0.3.3.d.0.0.0.0.0.0.0.0.0.0.0.0.0.0.0.8.e.f.ip6.arpa. (90)
23:18:18.351844 IP c.center-dns.jsinfo.net.domain > 192.168.100.11.57719: 1860 NXDomain* 0/1/0 (125)
23:18:18.352046 IP 192.168.100.11.38593 > c.center-dns.jsinfo.net.domain: 33804+ PTR? 252.0.0.224.in-addr.arpa. (42)
23:18:18.363336 IP c.center-dns.jsinfo.net.domain > 192.168.100.11.38593: 33804 NXDomain 0/1/0 (99)
23:18:18.422591 IP6 fe80::d3:3078:fcb7:2f2.63147 > ff02::1:3.hostmon: UDP, length 22
23:18:18.422632 IP 192.168.100.4.62971 > 224.0.0.252.hostmon: UDP, length 22
23:18:18.623013 IP 192.168.100.4.netbios-ns > 192.168.103.255.netbios-ns: NBT UDP PACKET(137): QUERY; REQUEST; BROADCAST
23:18:18.828996 IP 192.168.100.71 > 192.168.100.11: ICMP echo request, id 21532, seq 2613, length 64
23:18:18.829037 IP 192.168.100.11 > 192.168.100.71: ICMP echo reply, id 21532, seq 2613, length 64
23:18:19.372624 IP 192.168.100.4.netbios-ns > 192.168.103.255.netbios-ns: NBT UDP PACKET(137): QUERY; REQUEST; BROADCAST
23:18:19.830311 IP 192.168.100.71 > 192.168.100.11: ICMP echo request, id 21532, seq 2614, length 64
23:18:19.830359 IP 192.168.100.11 > 192.168.100.71: ICMP echo reply, id 21532, seq 2614, length 64
23:18:20.122760 IP 192.168.100.4.netbios-ns > 192.168.103.255.netbios-ns: NBT UDP PACKET(137): QUERY; REQUEST; BROADCAST
23:18:20.831451 IP 192.168.100.71 > 192.168.100.11: ICMP echo request, id 21532, seq 2615, length 64
23:18:20.831500 IP 192.168.100.11 > 192.168.100.71: ICMP echo reply, id 21532, seq 2615, length 64
23:18:21.832747 IP 192.168.100.71 > 192.168.100.11: ICMP echo request, id 21532, seq 2616, length 64
23:18:21.832797 IP 192.168.100.11 > 192.168.100.71: ICMP echo reply, id 21532, seq 2616, length 64
23:18:22.834181 IP 192.168.100.71 > 192.168.100.11: ICMP echo request, id 21532, seq 2617, length 64
23:18:22.834229 IP 192.168.100.11 > 192.168.100.71: ICMP echo reply, id 21532, seq 2617, length 64
23:18:23.835348 IP 192.168.100.71 > 192.168.100.11: ICMP echo request, id 21532, seq 2618, length 64
23:18:23.835390 IP 192.168.100.11 > 192.168.100.71: ICMP echo reply, id 21532, seq 2618, length 64
23:18:24.232451 IP 192.168.100.85.ssdp > 239.255.255.250.ssdp: UDP, length 133
23:18:24.232484 IP 192.168.100.85.ssdp > 239.255.255.250.ssdp: UDP, length 132
23:18:24.232495 IP 192.168.100.85.ssdp > 239.255.255.250.ssdp: UDP, length 137
23:18:24.232504 IP 192.168.100.85.ssdp > 239.255.255.250.ssdp: UDP, length 101
23:18:24.232513 IP 192.168.100.85.ssdp > 239.255.255.250.ssdp: UDP, length 101
23:18:24.232654 IP 192.168.100.11.60757 > c.center-dns.jsinfo.net.domain: 3616+ PTR? 85.100.168.192.in-addr.arpa. (45)
23:18:24.243122 IP c.center-dns.jsinfo.net.domain > 192.168.100.11.60757: 3616 NXDomain* 0/1/0 (80)
23:18:24.836500 IP 192.168.100.71 > 192.168.100.11: ICMP echo request, id 21532, seq 2619, length 64
23:18:24.836550 IP 192.168.100.11 > 192.168.100.71: ICMP echo reply, id 21532, seq 2619, length 64
23:18:25.837890 IP 192.168.100.71 > 192.168.100.11: ICMP echo request, id 21532, seq 2620, length 64
23:18:25.837939 IP 192.168.100.11 > 192.168.100.71: ICMP echo reply, id 21532, seq 2620, length 64
23:18:26.839247 IP 192.168.100.71 > 192.168.100.11: ICMP echo request, id 21532, seq 2621, length 64
23:18:26.839309 IP 192.168.100.11 > 192.168.100.71: ICMP echo reply, id 21532, seq 2621, length 64
23:18:27.629423 IP 192.168.100.11.34965 > kix01s01-in-f2.1e100.net.https: Flags [.], ack 3620502180, win 501, length 0
23:18:27.629601 IP 192.168.100.11.56871 > c.center-dns.jsinfo.net.domain: 22392+ PTR? 194.235.125.74.in-addr.arpa. (45)
23:18:27.641633 IP c.center-dns.jsinfo.net.domain > 192.168.100.11.56871: 22392 1/4/4 PTR kix01s01-in-f2.1e100.net. (229)
23:18:27.717412 IP kix01s01-in-f2.1e100.net.https > 192.168.100.11.34965: Flags [.], ack 1, win 1002, length 0
23:18:27.840452 IP 192.168.100.71 > 192.168.100.11: ICMP echo request, id 21532, seq 2622, length 64
23:18:27.840488 IP 192.168.100.11 > 192.168.100.71: ICMP echo reply, id 21532, seq 2622, length 64
23:18:28.552347 IP 192.168.100.11.48279 > tf-in-f125.1e100.net.xmpp-client: Flags [.], ack 4120166498, win 501, options [nop,nop,TS val 174761862 ecr 444726585], length 0
23:18:28.552504 IP 192.168.100.11.52957 > c.center-dns.jsinfo.net.domain: 131+ PTR? 125.72.194.173.in-addr.arpa. (45)
23:18:28.563307 IP c.center-dns.jsinfo.net.domain > 192.168.100.11.52957: 131 1/4/4 PTR tf-in-f125.1e100.net. (225)
23:18:28.611441 IP tf-in-f125.1e100.net.xmpp-client > 192.168.100.11.48279: Flags [.], ack 1, win 1002, options [nop,nop,TS val 444771642 ecr 174716862], length 0
23:18:28.841697 IP 192.168.100.71 > 192.168.100.11: ICMP echo request, id 21532, seq 2623, length 64
23:18:28.841737 IP 192.168.100.11 > 192.168.100.71: ICMP echo reply, id 21532, seq 2623, length 64
23:18:29.562740 IP6 fe80::d3:3078:fcb7:2f2.54094 > ff02::1:3.hostmon: UDP, length 22
23:18:29.562788 IP 192.168.100.4.64749 > 224.0.0.252.hostmon: UDP, length 22
23:18:29.563753 IP6 fe80::d3:3078:fcb7:2f2.64396 > ff02::1:3.hostmon: UDP, length 22
23:18:29.563785 IP 192.168.100.4.49933 > 224.0.0.252.hostmon: UDP, length 22
23:18:29.608415 IP 0.0.0.0 > all-systems.mcast.net: igmp query v2
23:18:29.608417 IP6 ::ac:6639:188:ffff > ff02::1: HBH ICMP6, multicast listener querymax resp delay: 1000 addr: ::, length 24
23:18:29.608620 IP 192.168.100.11.37159 > c.center-dns.jsinfo.net.domain: 8768+ PTR? 1.0.0.224.in-addr.arpa. (40)
23:18:29.618356 IP c.center-dns.jsinfo.net.domain > 192.168.100.11.37159: 8768 1/4/8 PTR all-systems.mcast.net. (338)
23:18:29.618566 IP 192.168.100.11.59002 > c.center-dns.jsinfo.net.domain: 20036+ PTR? 0.0.0.0.in-addr.arpa. (38)
23:18:29.630772 IP c.center-dns.jsinfo.net.domain > 192.168.100.11.59002: 20036 NXDomain* 0/1/0 (73)
23:18:29.630943 IP 192.168.100.11.59607 > c.center-dns.jsinfo.net.domain: 16050+ PTR? 1.0.0.0.0.0.0.0.0.0.0.0.0.0.0.0.0.0.0.0.0.0.0.0.0.0.0.0.2.0.f.f.ip6.arpa. (90)
23:18:29.641704 IP c.center-dns.jsinfo.net.domain > 192.168.100.11.59607: 16050 ServFail 0/0/0 (90)
23:18:29.641826 IP 192.168.100.11.35040 > a.center-dns.jsinfo.net.domain: 16050+ PTR? 1.0.0.0.0.0.0.0.0.0.0.0.0.0.0.0.0.0.0.0.0.0.0.0.0.0.0.0.2.0.f.f.ip6.arpa. (90)
23:18:29.649457 IP a.center-dns.jsinfo.net.domain > 192.168.100.11.35040: 16050 NXDomain 0/1/0 (160)
23:18:29.649619 IP 192.168.100.11.41220 > c.center-dns.jsinfo.net.domain: 38130+ PTR? f.f.f.f.8.8.1.0.9.3.6.6.c.a.0.0.0.0.0.0.0.0.0.0.0.0.0.0.0.0.0.0.ip6.arpa. (90)
23:18:29.661029 IP c.center-dns.jsinfo.net.domain > 192.168.100.11.41220: 38130 ServFail 0/0/0 (90)
23:18:29.661135 IP 192.168.100.11.39267 > a.center-dns.jsinfo.net.domain: 38130+ PTR? f.f.f.f.8.8.1.0.9.3.6.6.c.a.0.0.0.0.0.0.0.0.0.0.0.0.0.0.0.0.0.0.ip6.arpa. (90)
23:18:29.662268 IP6 fe80::d3:3078:fcb7:2f2.54094 > ff02::1:3.hostmon: UDP, length 22
23:18:29.662310 IP 192.168.100.4.64749 > 224.0.0.252.hostmon: UDP, length 22
23:18:29.663253 IP6 fe80::d3:3078:fcb7:2f2.64396 > ff02::1:3.hostmon: UDP, length 22
23:18:29.663279 IP 192.168.100.4.49933 > 224.0.0.252.hostmon: UDP, length 22
23:18:29.676011 IP 192.168.100.84 > 239.255.255.250: igmp v2 report 239.255.255.250
23:18:29.676037 IP 192.168.100.84 > 224.0.0.252: igmp v2 report 224.0.0.252
23:18:29.836402 ARP, Request who-has 192.168.100.71 tell 192.168.100.11, length 28
23:18:29.836706 ARP, Reply 192.168.100.71 is-at 52:54:00:59:ff:3e (oui Unknown), length 28
23:18:29.843712 IP 192.168.100.71 > 192.168.100.11: ICMP echo request, id 21532, seq 2624, length 64
23:18:29.843746 IP 192.168.100.11 > 192.168.100.71: ICMP echo reply, id 21532, seq 2624, length 64
23:18:29.862664 IP 192.168.100.4.netbios-ns > 192.168.103.255.netbios-ns: NBT UDP PACKET(137): QUERY; REQUEST; BROADCAST
23:18:29.863398 IP 192.168.100.4.netbios-ns > 192.168.103.255.netbios-ns: NBT UDP PACKET(137): QUERY; REQUEST; BROADCAST
23:18:29.910411 IP a.center-dns.jsinfo.net.domain > 192.168.100.11.39267: 38130 NXDomain 0/1/0 (160)
23:18:29.910646 IP 192.168.100.11.49150 > c.center-dns.jsinfo.net.domain: 21711+ PTR? 1.135.2.218.in-addr.arpa. (42)
23:18:29.921755 IP c.center-dns.jsinfo.net.domain > 192.168.100.11.49150: 21711 1/2/2 PTR a.center-dns.jsinfo.net. (154)
23:18:30.212491 IP 192.168.100.38 > 224.0.0.251: igmp v2 report 224.0.0.251
23:18:30.212638 IP 192.168.100.11.45872 > c.center-dns.jsinfo.net.domain: 17175+ PTR? 251.0.0.224.in-addr.arpa. (42)
23:18:30.222475 IP c.center-dns.jsinfo.net.domain > 192.168.100.11.45872: 17175 NXDomain 0/1/0 (99)
23:18:30.222641 IP 192.168.100.11.43486 > c.center-dns.jsinfo.net.domain: 47845+ PTR? 38.100.168.192.in-addr.arpa. (45)
23:18:30.234595 IP c.center-dns.jsinfo.net.domain > 192.168.100.11.43486: 47845 NXDomain* 0/1/0 (80)
23:18:30.612369 IP 192.168.100.4.netbios-ns > 192.168.103.255.netbios-ns: NBT UDP PACKET(137): QUERY; REQUEST; BROADCAST
23:18:30.613349 IP 192.168.100.4.netbios-ns > 192.168.103.255.netbios-ns: NBT UDP PACKET(137): QUERY; REQUEST; BROADCAST
23:18:30.685309 IP 192.168.100.4 > 229.255.255.250: igmp v2 report 229.255.255.250
23:18:30.685467 IP 192.168.100.11.44231 > c.center-dns.jsinfo.net.domain: 6270+ PTR? 250.255.255.229.in-addr.arpa. (46)
23:18:30.697168 IP c.center-dns.jsinfo.net.domain > 192.168.100.11.44231: 6270 NXDomain 0/1/0 (103)
23:18:30.845790 IP 192.168.100.71 > 192.168.100.11: ICMP echo request, id 21532, seq 2625, length 64
23:18:30.845829 IP 192.168.100.11 > 192.168.100.71: ICMP echo reply, id 21532, seq 2625, length 64
23:18:31.362262 IP 192.168.100.4.netbios-ns > 192.168.103.255.netbios-ns: NBT UDP PACKET(137): QUERY; REQUEST; BROADCAST
23:18:31.363269 IP 192.168.100.4.netbios-ns > 192.168.103.255.netbios-ns: NBT UDP PACKET(137): QUERY; REQUEST; BROADCAST
23:18:31.430218 IP 192.168.100.6.17500 > 255.255.255.255.17500: UDP, length 110
23:18:31.433195 IP 192.168.100.6.17500 > 192.168.103.255.17500: UDP, length 110
23:18:31.846827 IP 192.168.100.71 > 192.168.100.11: ICMP echo request, id 21532, seq 2626, length 64
23:18:31.846870 IP 192.168.100.11 > 192.168.100.71: ICMP echo reply, id 21532, seq 2626, length 64
23:18:32.629406 ARP, Request who-has 192.168.100.254 tell 192.168.100.11, length 28
23:18:32.630918 ARP, Reply 192.168.100.254 is-at 54:75:d0:28:3f:4b (oui Unknown), length 46
23:18:32.848958 IP 192.168.100.71 > 192.168.100.11: ICMP echo request, id 21532, seq 2627, length 64
23:18:32.849003 IP 192.168.100.11 > 192.168.100.71: ICMP echo reply, id 21532, seq 2627, length 64
23:18:33.850394 IP 192.168.100.71 > 192.168.100.11: ICMP echo request, id 21532, seq 2628, length 64
23:18:33.850443 IP 192.168.100.11 > 192.168.100.71: ICMP echo reply, id 21532, seq 2628, length 64
23:18:33.946988 IP 192.168.100.12 > 224.0.1.178: igmp v2 report 224.0.1.178
23:18:33.947146 IP 192.168.100.11.40782 > c.center-dns.jsinfo.net.domain: 28714+ PTR? 178.1.0.224.in-addr.arpa. (42)
23:18:33.962787 IP c.center-dns.jsinfo.net.domain > 192.168.100.11.40782: 28714 ServFail 0/0/0 (42)
23:18:33.962901 IP 192.168.100.11.56610 > a.center-dns.jsinfo.net.domain: 28714+ PTR? 178.1.0.224.in-addr.arpa. (42)
23:18:33.971031 IP a.center-dns.jsinfo.net.domain > 192.168.100.11.56610: 28714 NXDomain 0/1/0 (99)
23:18:33.971190 IP 192.168.100.11.47356 > c.center-dns.jsinfo.net.domain: 3322+ PTR? 12.100.168.192.in-addr.arpa. (45)
23:18:33.984065 IP c.center-dns.jsinfo.net.domain > 192.168.100.11.47356: 3322 NXDomain* 0/1/0 (80)
23:18:34.809156 IP 192.168.100.8 > 224.0.0.253: igmp v2 report 224.0.0.253
23:18:34.809349 IP 192.168.100.11.60577 > c.center-dns.jsinfo.net.domain: 31065+ PTR? 253.0.0.224.in-addr.arpa. (42)
23:18:34.821705 IP c.center-dns.jsinfo.net.domain > 192.168.100.11.60577: 31065 NXDomain 0/1/0 (99)
23:18:34.821875 IP 192.168.100.11.48541 > c.center-dns.jsinfo.net.domain: 51257+ PTR? 8.100.168.192.in-addr.arpa. (44)
23:18:34.833318 IP c.center-dns.jsinfo.net.domain > 192.168.100.11.48541: 51257 NXDomain* 0/1/0 (79)
23:18:34.851758 IP 192.168.100.71 > 192.168.100.11: ICMP echo request, id 21532, seq 2629, length 64
23:18:34.851792 IP 192.168.100.11 > 192.168.100.71: ICMP echo reply, id 21532, seq 2629, length 64
23:18:35.853701 IP 192.168.100.71 > 192.168.100.11: ICMP echo request, id 21532, seq 2630, length 64
23:18:35.853748 IP 192.168.100.11 > 192.168.100.71: ICMP echo reply, id 21532, seq 2630, length 64
23:18:36.855092 IP 192.168.100.71 > 192.168.100.11: ICMP echo request, id 21532, seq 2631, length 64
23:18:36.855139 IP 192.168.100.11 > 192.168.100.71: ICMP echo reply, id 21532, seq 2631, length 64
23:18:37.856072 IP 192.168.100.71 > 192.168.100.11: ICMP echo request, id 21532, seq 2632, length 64
23:18:37.856122 IP 192.168.100.11 > 192.168.100.71: ICMP echo reply, id 21532, seq 2632, length 64
23:18:38.857247 IP 192.168.100.71 > 192.168.100.11: ICMP echo request, id 21532, seq 2633, length 64
23:18:38.857310 IP 192.168.100.11 > 192.168.100.71: ICMP echo reply, id 21532, seq 2633, length 64
23:18:39.108305 IP6 fe80::6dac:7dfc:cbe8:95ee.dhcpv6-client > ff02::1:2.dhcpv6-server: dhcp6 solicit
23:18:39.858312 IP 192.168.100.71 > 192.168.100.11: ICMP echo request, id 21532, seq 2634, length 64
23:18:39.858362 IP 192.168.100.11 > 192.168.100.71: ICMP echo reply, id 21532, seq 2634, length 64
23:18:40.859271 IP 192.168.100.71 > 192.168.100.11: ICMP echo request, id 21532, seq 2635, length 64
23:18:40.859334 IP 192.168.100.11 > 192.168.100.71: ICMP echo reply, id 21532, seq 2635, length 64
23:18:41.860472 IP 192.168.100.71 > 192.168.100.11: ICMP echo request, id 21532, seq 2636, length 64
23:18:41.860520 IP 192.168.100.11 > 192.168.100.71: ICMP echo reply, id 21532, seq 2636, length 64
23:18:41.973573 IP6 fe80::d3:3078:fcb7:2f2.60156 > ff02::1:3.hostmon: UDP, length 22
23:18:41.973629 IP 192.168.100.4.64855 > 224.0.0.252.hostmon: UDP, length 22
23:18:42.072901 IP6 fe80::d3:3078:fcb7:2f2.60156 > ff02::1:3.hostmon: UDP, length 22
23:18:42.072933 IP 192.168.100.4.64855 > 224.0.0.252.hostmon: UDP, length 22
23:18:42.273131 IP 192.168.100.4.netbios-ns > 192.168.103.255.netbios-ns: NBT UDP PACKET(137): QUERY; REQUEST; BROADCAST
23:18:42.861645 IP 192.168.100.71 > 192.168.100.11: ICMP echo request, id 21532, seq 2637, length 64
23:18:42.861694 IP 192.168.100.11 > 192.168.100.71: ICMP echo reply, id 21532, seq 2637, length 64
23:18:43.022945 IP 192.168.100.4.netbios-ns > 192.168.103.255.netbios-ns: NBT UDP PACKET(137): QUERY; REQUEST; BROADCAST
23:18:43.772893 IP 192.168.100.4.netbios-ns > 192.168.103.255.netbios-ns: NBT UDP PACKET(137): QUERY; REQUEST; BROADCAST
23:18:43.862873 IP 192.168.100.71 > 192.168.100.11: ICMP echo request, id 21532, seq 2638, length 64
23:18:43.862912 IP 192.168.100.11 > 192.168.100.71: ICMP echo reply, id 21532, seq 2638, length 64
23:18:44.864939 IP 192.168.100.71 > 192.168.100.11: ICMP echo request, id 21532, seq 2639, length 64
23:18:44.864984 IP 192.168.100.11 > 192.168.100.71: ICMP echo reply, id 21532, seq 2639, length 64
23:18:45.867155 IP 192.168.100.71 > 192.168.100.11: ICMP echo request, id 21532, seq 2640, length 64
23:18:45.867203 IP 192.168.100.11 > 192.168.100.71: ICMP echo reply, id 21532, seq 2640, length 64
23:18:46.868495 IP 192.168.100.71 > 192.168.100.11: ICMP echo request, id 21532, seq 2641, length 64
23:18:46.868544 IP 192.168.100.11 > 192.168.100.71: ICMP echo reply, id 21532, seq 2641, length 64
23:18:47.869712 IP 192.168.100.71 > 192.168.100.11: ICMP echo request, id 21532, seq 2642, leng